{
  "schema_version": 1,
  "generated_at": "2026-03-10T22:31:27+08:00",
  "marketplace": {
    "name": "Blog Plugin Market",
    "repo": "natsume37/Blog-plugin-market",
    "branch": "main",
    "source": "github"
  },
  "plugins": [
    {
      "plugin_id": "ai-assistant",
      "manifest_path": "../plugins/ai-assistant/manifest.json",
      "readme_path": "../plugins/ai-assistant/README.md",
      "changelog_path": "../plugins/ai-assistant/CHANGELOG.md"
    },
    {
      "plugin_id": "wechat-official-account",
      "manifest_path": "../plugins/wechat-official-account/manifest.json",
      "readme_path": "../plugins/wechat-official-account/README.md",
      "changelog_path": "../plugins/wechat-official-account/CHANGELOG.md"
    },
    {
      "plugin_id": "friend-link-toolkit",
      "manifest_path": "../plugins/friend-link-toolkit/manifest.json",
      "readme_path": "../plugins/friend-link-toolkit/README.md",
      "changelog_path": "../plugins/friend-link-toolkit/CHANGELOG.md"
    }
  ]
}
